{
  "schema": "system_compiler.runtime_observe_snapshot/v0",
  "generated_at_utc": "2026-04-16T08:00:00Z",
  "generator": "examples.usb.host.runtime_multi_smoke",
  "published_capabilities": [
    "block.usb0",
    "io.usb0"
  ],
  "observed_capabilities": [
    "block.usb0",
    "io.usb0"
  ],
  "publish_state_summary": {
    "missing": 0,
    "published": 2
  },
  "export_state_summary": {
    "missing": 0,
    "detached": 1,
    "attached": 1
  },
  "recent_transitions": [
    {
      "capability": "block.usb0",
      "action": "ensure_exported",
      "before": "missing",
      "after": "detached"
    },
    {
      "capability": "block.usb0",
      "action": "attach",
      "before": "detached",
      "after": "attached"
    },
    {
      "capability": "io.usb0",
      "action": "ensure_exported",
      "before": "missing",
      "after": "detached"
    }
  ]
}
